{
  "$schema": "http://json-schema.org/draft-07/schema#",
  "title": "Evidence-Based Recommendation",
  "description": "Schema for a single evidence-based recommendation for population health care management teams",
  "type": "object",
  "required": [
    "id",
    "title",
    "domain",
    "role",
    "implementation_guidance",
    "expected_outcomes",
    "target_population",
    "citation"
  ],
  "properties": {
    "id": {
      "type": "string",
      "description": "Unique identifier for the recommendation"
    },
    "title": {
      "type": "string",
      "description": "Brief title of the recommendation"
    },
    "domain": {
      "type": "string",
      "description": "Clinical condition or social need domain",
      "enum": [
        "Diabetes",
        "Hypertension",
        "Depression",
        "Anxiety",
        "Substance Use Disorders",
        "Housing",
        "Food Security",
        "Transportation",
        "Asthma",
        "COPD",
        "Heart Failure",
        "Preventive Screenings",
        "Medication Adherence",
        "Care Transitions",
        "CKD",
        "Post MI",
        "Post Stroke",
        "HIV",
        "Vaccination",
        "EPSDT",
        "Prenatal",
        "Postnatal"
      ]
    },
    "role": {
      "type": "string",
      "description": "Professional role the recommendation is tailored for",
      "enum": [
        "Nurse Care Manager",
        "Clinical Pharmacist",
        "Community Health Worker",
        "Social Worker (Non-Clinical)",
        "Care Coordinator",
        "Social Worker (Clinical/Therapy)",
        "Pharmacy Technician",
        "Doula"
      ]
    },
    "implementation_guidance": {
      "type": "string",
      "description": "Detailed guidance on how to implement the recommendation"
    },
    "expected_outcomes": {
      "type": "string",
      "description": "Expected outcomes when the recommendation is implemented"
    },
    "target_population": {
      "type": "string",
      "description": "Specific population for whom the recommendation is intended"
    },
    "citation": {
      "type": "string",
      "description": "Citation for the evidence supporting the recommendation in JAMA/AMA style"
    },
    "evidence_level": {
      "type": "string",
      "description": "Level of evidence supporting the recommendation",
      "enum": [
        "A - Strong",
        "B - Moderate",
        "C - Limited",
        "D - Expert Opinion"
      ]
    },
    "tags": {
      "type": "array",
      "description": "Additional tags for filtering and categorization",
      "items": {
        "type": "string"
      }
    },
    "last_updated": {
      "type": "string",
      "format": "date",
      "description": "Date when the recommendation was last updated"
    }
  }
}
